<?xml version="1.0" encoding="UTF-8"?>
<!ELEMENT scores (student*)>
<!ELEMENT student (name,course,score)>
<!ATTLIST student id CDATA #IMPLIED>
<!ATTLIST student class CDATA #IMPLIED>
<!ELEMENT name (#PCDATA)>
<!ELEMENT course (#PCDATA)>
<!ELEMENT score (#PCDATA)>